{
  "$schema": "https://json-schema.org/draft/2020-12/schema",
  "$id": "https://wistprotocol.org/schemas/publisher-item.schema.json",
  "title": "WIST publisher_item Entry body (WIST-3)",
  "description": "The body of a publisher_item Entry (WIST-3 section 3.3): an Item, the name of its Collection, the Catalog ID of the Catalog it is proved against and its Inclusion Proof against that Catalog. The form alone does not prove the Item against the Catalog; WIST-3 section 3.3's conditions I1 to I7 judge the Entry.",
  "type": "object",
  "required": ["item", "collection", "catalog", "proof"],
  "additionalProperties": false,
  "properties": {
    "item": {"$ref": "item.schema.json", "description": "An Item (WIST-1 section 3.3)."},
    "collection": {"type": "string", "pattern": "^[a-z0-9]([a-z0-9-]{0,30}[a-z0-9])?$(?![\\s\\S])", "description": "The name of the Item's Collection, in the form of WIST-1 section 5.1."},
    "catalog": {"type": "string", "pattern": "^sha256:[0-9a-f]{64}$(?![\\s\\S])", "description": "The Catalog ID of the Catalog the Item is proved against."},
    "proof": {
      "type": "object",
      "required": ["index", "tree_size", "path"],
      "additionalProperties": false,
      "description": "The Item's Inclusion Proof against the named Catalog (WIST-1 section 4.3).",
      "properties": {
        "index": {"type": "integer", "minimum": 0, "maximum": 9007199254740991, "description": "The Item's position in the list, from 0."},
        "tree_size": {"type": "integer", "minimum": 0, "maximum": 9007199254740991, "description": "The Catalog's size."},
        "path": {"type": "array", "items": {"type": "string", "pattern": "^[0-9a-f]{64}$(?![\\s\\S])"}, "description": "The sibling hashes from the leaf up, each 64 lowercase hexadecimal digits."}
      }
    }
  }
}
