{
  "item": {
    "publisher": "example.com",
    "url": "https://example.com/blog/post-1",
    "observed_at": "2026-08-02T12:00:00Z",
    "payload": {
      "commitment": "hmac-sha256:25d23a19718b942a02241f8aae07a3837b9e648fb3836dd9623c3aa8ce4702b3",
      "alg": "HMAC-SHA256",
      "bytes": 263
    },
    "meta": {
      "lang": "en",
      "topics": [
        "software"
      ],
      "license": "CC-BY-4.0"
    }
  },
  "collection": "default",
  "catalog": "sha256:aa5c561390ba098ab186583627f9e04022aef500db67f0e04383dd705e1178b7",
  "proof": {
    "index": 0,
    "tree_size": 1,
    "path": []
  }
}
